picture_no,user_text
1,orange suit energy — ready for launch day
2,my cat judging me again
3,need this espresso before anything else
4,rocket on the pad at twilight hits different
5,horse in the field = instant calm
6,vintage bike + golden hour = main character walk
7,ramen night no questions asked
8,shooting film on the weekend
9,apple on the counter = healthy morning ig
10,rainy city walk with umbrellas out
11,good boy golden retriever smile
12,sushi platter date night vibes
13,dream cabin in the snow please
14,sunset drive in the red ferrari kinda day
15,pink tulips on the windowsill = spring mood
16,laptop closed for once (study break)
17,balloons at sunrise in cappadocia bucket list
18,moody lighthouse + crashing waves
19,pancake stack sunday morning
20,violin in the study — classical chill
